[
  {
    "text": "Great leaders inspire greatness in others.",
    "episodeTitle": "Ambush",
    "season": 1,
    "episode": 1,
    "arc": "Ambush"
  },
  {
    "text": "Belief is not a matter of choice, but of conviction.",
    "episodeTitle": "Rising Malevolence",
    "season": 1,
    "episode": 2,
    "arc": "Malevolence"
  },
  {
    "text": "Easy is the path to wisdom for those not blinded by ego.",
    "episodeTitle": "Shadow of Malevolence",
    "season": 1,
    "episode": 3,
    "arc": "Malevolence"
  },
  {
    "text": "A plan is only as good as those who see it through.",
    "episodeTitle": "Destroy Malevolence",
    "season": 1,
    "episode": 4,
    "arc": "Malevolence"
  },
  {
    "text": "The best confidence builder is experience.",
    "episodeTitle": "Rookies",
    "season": 1,
    "episode": 5,
    "arc": "Rookies"
  },
  {
    "text": "Trust in your friends, and they'll have reason to trust in you.",
    "episodeTitle": "Downfall of a Droid",
    "season": 1,
    "episode": 6,
    "arc": "Downfall of a Droid"
  },
  {
    "text": "You hold onto friends by keeping your heart a little softer than your head.",
    "episodeTitle": "Duel of the Droids",
    "season": 1,
    "episode": 7,
    "arc": "Downfall of a Droid"
  },
  {
    "text": "Heroes are made by the times.",
    "episodeTitle": "Bombad Jedi",
    "season": 1,
    "episode": 8,
    "arc": "Bombad Jedi"
  },
  {
    "text": "Ignore your instincts at your peril.",
    "episodeTitle": "Cloak of Darkness",
    "season": 1,
    "episode": 9,
    "arc": "Cloak of Darkness"
  },
  {
    "text": "Most powerful is he who controls his own power.",
    "episodeTitle": "Lair of Grievous",
    "season": 1,
    "episode": 10,
    "arc": "Lair of Grievous"
  },
  {
    "text": "The winding path to peace is always a worthy one, regardless of how many turns it takes.",
    "episodeTitle": "Dooku Captured",
    "season": 1,
    "episode": 11,
    "arc": "Dooku Captured"
  },
  {
    "text": "Fail with honor rather than succeed by fraud.",
    "episodeTitle": "The Gungan General",
    "season": 1,
    "episode": 12,
    "arc": "Dooku Captured"
  },
  {
    "text": "Greed and fear of loss are the roots that lead to the tree of evil.",
    "episodeTitle": "Jedi Crash",
    "season": 1,
    "episode": 13,
    "arc": "Jedi Crash"
  },
  {
    "text": "When surrounded by war, one must eventually choose a side.",
    "episodeTitle": "Defenders of Peace",
    "season": 1,
    "episode": 14,
    "arc": "Jedi Crash"
  },
  {
    "text": "Arrogance diminishes wisdom.",
    "episodeTitle": "Trespass",
    "season": 1,
    "episode": 15,
    "arc": "Trespass"
  },
  {
    "text": "Truth enlightens the mind, but won't always bring happiness to your heart.",
    "episodeTitle": "The Hidden Enemy",
    "season": 1,
    "episode": 16,
    "arc": "The Hidden Enemy"
  },
  {
    "text": "Fear is a disease; hope is its only cure.",
    "episodeTitle": "Blue Shadow Virus",
    "season": 1,
    "episode": 17,
    "arc": "Blue Shadow Virus"
  },
  {
    "text": "A single chance is a galaxy of hope.",
    "episodeTitle": "Mystery of a Thousand Moons",
    "season": 1,
    "episode": 18,
    "arc": "Blue Shadow Virus"
  },
  {
    "text": "It is a rough road that leads to the heights of greatness.",
    "episodeTitle": "Storm Over Ryloth",
    "season": 1,
    "episode": 19,
    "arc": "Ryloth"
  },
  {
    "text": "The costs of war can never be truly accounted for.",
    "episodeTitle": "Innocents of Ryloth",
    "season": 1,
    "episode": 20,
    "arc": "Ryloth"
  },
  {
    "text": "Compromise is a virtue to be cultivated, not a weakness to be despised.",
    "episodeTitle": "Liberty on Ryloth",
    "season": 1,
    "episode": 21,
    "arc": "Ryloth"
  },
  {
    "text": "A secret shared is a trust formed.",
    "episodeTitle": "Hostage Crisis",
    "season": 1,
    "episode": 22,
    "arc": "Hostage Crisis"
  },
  {
    "text": "A lesson learned is a lesson earned.",
    "episodeTitle": "Holocron Heist",
    "season": 2,
    "episode": 1,
    "arc": "Holocron Heist"
  },
  {
    "text": "Overconfidence is the most dangerous form of carelessness.",
    "episodeTitle": "Cargo of Doom",
    "season": 2,
    "episode": 2,
    "arc": "Holocron Heist"
  },
  {
    "text": "The first step to correcting a mistake is patience.",
    "episodeTitle": "Children of the Force",
    "season": 2,
    "episode": 3,
    "arc": "Holocron Heist"
  },
  {
    "text": "A true heart should never be doubted.",
    "episodeTitle": "Senate Spy",
    "season": 2,
    "episode": 4,
    "arc": "Senate Spy"
  },
  {
    "text": "Believe in yourself or no one else will.",
    "episodeTitle": "Landing at Point Rain",
    "season": 2,
    "episode": 5,
    "arc": "Geonosis Factory"
  },
  {
    "text": "No gift is more precious than trust.",
    "episodeTitle": "Weapons Factory",
    "season": 2,
    "episode": 6,
    "arc": "Geonosis Factory"
  },
  {
    "text": "Sometimes, accepting help is harder than offering it.",
    "episodeTitle": "Legacy of Terror",
    "season": 2,
    "episode": 7,
    "arc": "Geonosian Zombies"
  },
  {
    "text": "Attachment is not compassion.",
    "episodeTitle": "Brain Invaders",
    "season": 2,
    "episode": 8,
    "arc": "Geonosian Zombies"
  },
  {
    "text": "For everything you gain, you lose something else.",
    "episodeTitle": "Grievous Intrigue",
    "season": 2,
    "episode": 9,
    "arc": "Grievous Intrigue"
  },
  {
    "text": "It is the quest for honor that makes one honorable.",
    "episodeTitle": "The Deserter",
    "season": 2,
    "episode": 10,
    "arc": "The Deserter"
  },
  {
    "text": "Easy isn't always simple.",
    "episodeTitle": "Lightsaber Lost",
    "season": 2,
    "episode": 11,
    "arc": "Lightsaber Lost"
  },
  {
    "text": "If you ignore the past, you jeopardize the future.",
    "episodeTitle": "The Mandalore Plot",
    "season": 2,
    "episode": 12,
    "arc": "Mandalore"
  },
  {
    "text": "Fear not for the future, weep not for the past.",
    "episodeTitle": "Voyage of Temptation",
    "season": 2,
    "episode": 13,
    "arc": "Mandalore"
  },
  {
    "text": "In war, truth is the first casualty.",
    "episodeTitle": "Duchess of Mandalore",
    "season": 2,
    "episode": 14,
    "arc": "Mandalore"
  },
  {
    "text": "Searching for the truth is easy. Accepting the truth is hard.",
    "episodeTitle": "Senate Murders",
    "season": 2,
    "episode": 15,
    "arc": "Senate Murders"
  },
  {
    "text": "A wise leader knows when to follow.",
    "episodeTitle": "Cat and Mouse",
    "season": 2,
    "episode": 16,
    "arc": "Cat and Mouse"
  },
  {
    "text": "Courage makes heroes, but trust builds friendships.",
    "episodeTitle": "Bounty Hunters",
    "season": 2,
    "episode": 17,
    "arc": "Bounty Hunters"
  },
  {
    "text": "Choose what is right, not what is easy.",
    "episodeTitle": "The Zillo Beast",
    "season": 2,
    "episode": 18,
    "arc": "Zillo Beast"
  },
  {
    "text": "The most dangerous beast is the beast within.",
    "episodeTitle": "The Zillo Beast Strikes Back",
    "season": 2,
    "episode": 19,
    "arc": "Zillo Beast"
  },
  {
    "text": "Who my father was matters less than my memory of him.",
    "episodeTitle": "Death Trap",
    "season": 2,
    "episode": 20,
    "arc": "Boba Fett Revenge"
  },
  {
    "text": "Adversity is a friendship's truest test.",
    "episodeTitle": "R2 Come Home",
    "season": 2,
    "episode": 21,
    "arc": "Boba Fett Revenge"
  },
  {
    "text": "Revenge is a confession of pain.",
    "episodeTitle": "Lethal Trackdown",
    "season": 2,
    "episode": 22,
    "arc": "Boba Fett Revenge"
  },
  {
    "text": "Brothers in arms are brothers for life.",
    "episodeTitle": "Clone Cadets",
    "season": 3,
    "episode": 1,
    "arc": "Kamino Defense"
  },
  {
    "text": "Fighting a war tests a soldier's skills, defending his home tests a soldier's heart.",
    "episodeTitle": "ARC Troopers",
    "season": 3,
    "episode": 2,
    "arc": "Kamino Defense"
  },
  {
    "text": "Where there's a will, there's a way.",
    "episodeTitle": "Supply Lines",
    "season": 3,
    "episode": 3,
    "arc": "Supply Lines"
  },
  {
    "text": "A child stolen is a hope lost.",
    "episodeTitle": "Sphere of Influence",
    "season": 3,
    "episode": 4,
    "arc": "Sphere of Influence"
  },
  {
    "text": "The challenge of hope is to overcome corruption.",
    "episodeTitle": "Corruption",
    "season": 3,
    "episode": 5,
    "arc": "Corruption"
  },
  {
    "text": "Those who enforce the law must obey the law.",
    "episodeTitle": "The Academy",
    "season": 3,
    "episode": 6,
    "arc": "Corruption"
  },
  {
    "text": "The future has many paths - choose wisely.",
    "episodeTitle": "Assassin",
    "season": 3,
    "episode": 7,
    "arc": "Assassin"
  },
  {
    "text": "A failure in planning is a plan for failure.",
    "episodeTitle": "Evil Plans",
    "season": 3,
    "episode": 8,
    "arc": "Hunt for Ziro"
  },
  {
    "text": "Love comes in all shapes and sizes.",
    "episodeTitle": "Hunt for Ziro",
    "season": 3,
    "episode": 9,
    "arc": "Hunt for Ziro"
  },
  {
    "text": "Fear is a great motivator.",
    "episodeTitle": "Heroes on Both Sides",
    "season": 3,
    "episode": 10,
    "arc": "Pursuit of Peace"
  },
  {
    "text": "Truth can strike down the spectre of fear.",
    "episodeTitle": "Pursuit of Peace",
    "season": 3,
    "episode": 11,
    "arc": "Pursuit of Peace"
  },
  {
    "text": "The swiftest path to destruction is through vengeance.",
    "episodeTitle": "Nightsisters",
    "season": 3,
    "episode": 12,
    "arc": "Nightsisters"
  },
  {
    "text": "Evil is not born, it is taught.",
    "episodeTitle": "Monster",
    "season": 3,
    "episode": 13,
    "arc": "Nightsisters"
  },
  {
    "text": "The path to evil may bring great power, but not loyalty.",
    "episodeTitle": "Witches of the Mist",